S.No.,User_query,Bot_reply,Relevant
234,How quickly can I get to NDLS railway station from DLF Primus at peak time?,Let me calculate that for you,Yes
235,How quickly can I get to the NZM railway station from DLF Primus off peak time?,Calculating the desired information...,Yes
236,Can you help me look for the closest railway station from DLF Primus?,"Yes, let me find out the exact information for you",Yes
237,Find nearest Railway Station from DLF Primus,Hold on as I look up the required information,Yes
238,Locate closest Railway Station from DLF Primus,Let me locate that for you.,Yes
239,I want to go to the Railway Station closest to DLF Primus,Hold on while I look for the required data,Yes
240,Nearest railway station from DLF Primus,Let me show you the best option available,Yes
241,Shortest route to the nearest railway station from DLF Primus at peak time,Finding the best solution to your query...,Yes
242,Domestic Airport from Ireo Skyon,Looking for the required data..,Yes
243,How quickly can I get to Domestic Airport from Ireo Skyon at peak time?,Let me calculate that for you,Yes
244,How quickly can I get to the Domestic Airport from Ireo Skyon off peak time?,Calculating the desired information...,Yes
245,Can you help me look for the Domestic Airport from Ireo Skyon?,"Yes, let me find out the exact information for you",Yes
246,Find Domestic Airport from Ireo Skyon,Hold on as I look up the required information,Yes
247,Locate Domestic Airport from Ireo Skyon,Let me locate that for you.,Yes
248,I want to go to the Domestic Airport closest to Ireo Skyon,Let me help you with that.,Yes
249,Shortest route to the DomesticAirport from Ireo Skyon at peak time,Finding the best solution to your query...,Yes
250,International Airport from Ireo Skyon,Looking for the required data near your location of choice.,Yes
251,How quickly can I get to International Airport from Ireo Skyon at peak time?,Let me calculate that for you,Yes
252,How quickly can I get to the International Airport from Ireo Skyon off peak time?,Calculating the desired information...,Yes
253,Can you help me look for the International Airport from Ireo Skyon?,"Yes, let me find out the exact information for you",Yes
254,Find International Airport from Ireo Skyon,Hold on as I look up the required information,Yes
255,Locate International Airport from Ireo Skyon,Let me locate the service required by you.,Yes
256,I want to go to the Int. Airport closest to Ireo Skyon,Let me help you with that.,Yes
257,Shortest route to the Int. Airport from Ireo Skyon at peak time,Finding the best solution to your query...,Yes
258,Bus station from Paras Dews,Looking for the required service for you.,Yes
259,How quickly can I get to the Bus station from Paras Dews at peak time?,Let me calculate that for you,Yes
260,How quickly can I get to the Bus station from Paras Dews off peak time?,Calculating the desired information...,Yes
261,Can you help me look for the closest Bus station from Paras Dews?,"Yes, let me find out the exact information for you",Yes
262,Find nearest Bus Station from Paras Dews,Hold on as I look up the required information,Yes
263,Locate closest Bus Station from Paras Dews,Let me locate the service required by you.,Yes
264,I want to take the Bus closest to Paras Dews,Let me help you with that.,Yes
265,Nearest Bus service from Paras Dews,Let me show you the best option available,Yes
266,Shortest route to the nearest Bus line from Paras Dews at peak time,Finding the best solution to your query...,Yes
267,I am looking for a 2BHK with more than 700sqft area,Excellent choice. Let me look up some options for you,Yes
268,What is the sqft area of a 3BHK in Premia towers,Looking for information desired by you.,Yes
269,How much should the carpet area be for a 2BHK?,Please wait while I generate the required information,Yes
270,Can you tell me the carpet area of 3BHKs in New Gurgaon?,"Yes, let me show you the best options available for you.",Yes
271,Looking for a spacious apartment with more than 1000sqft area on Sohna Road,Let me help you with that. What are your other requirements?,Yes
272,Show me 3BHKs available on Sohna Road,"Yes, let me show you the best options available at your choice of location.",Yes
273,How far is Gulmohar Avenue from the main road?,Let me calculate that for you,Yes
274,What is the nearest main road from Gulmohar Avenue?,Let me find out the information that you require.,Yes
275,Is Gulmohar Avenue on the main road?,Let me find that out for you,Yes
276,Show me the google maps location of Gulmohar Avenue,Let me look that up for you.,Yes
277,I do not want to see societies present on the main road,Okay. Let me look up options suitable to your liking.,Yes
278,Are there any Auto Stands near Lotus Elise?,"Yes, let me look that up for you",Yes
279,Can you find me an auto stand near Lotus Elise?,"Certainly, give me a moment as I look for options most suitable for you.",Yes
280,What is the chance of getting auto services near Lotus Elise?,Finding the best solution to your query...,Yes
281,What is the availability of autos like near Lotus Elise?,Let me locate the services required by you,Yes
282,I want to take an auto daily from near Lotus Elise.,"Okay, hold on as I look for the desired information.",Yes
283,Can you help me locate auto stands near Lotus Elise?,"Definitely, let me locate the best options available.",Yes
284,Are there any Cab Stands near Landmark residency?,"Yes, let me look that up for you",Yes
285,Can you find me an cab stand near Landmark residency?,"Certainly, give me a moment as I look for the requested data.",Yes
286,What is the chance of getting cab services near Landmark residency?,Finding the best solution to your query,Yes
287,What is the availability of cab like near Landmark residency?,Let me locate the services required by you,Yes
288,I want to take an cab daily from near Landmark residency,"Okay, hold on as I look for the required data.",Yes
289,Can you help me locate cab stands near Landmark residency?,"Definitely, let me locate the service available for you.",Yes
290,Police Station close to Central Park I,Let me locate the service required by you,Yes
291,Are there any police hold posts near Central Park I?,Looking for the required service available for you.,Yes
292,Can you help me locate the police station closest to Central Park I?,"Certainly, give me a moment as I look for the desired data.",Yes
293,Find police station near Central Park I,"Okay, hold on as I look for the data requested by you.",Yes
294,What are the nearest banks around Bestech park View City 1?,Let me look up the best options available for you.,Yes
295,Is there a State Bank near Bestech park View City 1?,Let me look up the information required by you,Yes
296,Can you help me look for bank services available near Bestech park View City 1?,"Certainly, give me a moment as I look for the desired information.",Yes
297,Bank Services close to Bestech park View City 1,Let me show you the best options available for you.,Yes
298,Locate Banks near Bestech park View City 1,Locating the best options available.,Yes
299,How far is the nearest Bank from Central Park I?,Let me calculate that for you.,Yes
300,What are the nearest Petrol Stations around Mapsco Paradise?,Let me look up the best options available for you.,Yes
301,Is there a Petrol Pump near Mapsco Paradise?,Let me look up the information required by you,Yes
302,Can you help me look for Petrol Stations available near Mapsco Paradise?,"Certainly, give me a moment as I look for the requested data.",Yes
303,Petrol Pumps close to Mapsco Paradise,Let me show you the best options available for you.,Yes
304,Locate Petrol Pumps near Mapsco Paradise,Locating the best options available for you.,Yes
305,How far is the nearest Petrol Station from Mapsco Paradise?,Let me calculate that for you,Yes
306,Show me 3BHKs available on Dwarka Expressway,Let me show you a listing of the best options available for you.,Yes
307,How far is Manor One from the Expressway?,Calculating the desired information...,Yes
308,What is the nearest expresway road from Manor One?,Let me find out the information that you require.,Yes
309,Is Manor One on the Expressway?,Let me find that out for you,Yes
310,Are you a real robot?,Yes! I am here to help you with your choices in Real Estate. What are you looking for?,Yes
311,I want to rent an apartment at DLF Camellias,"Great, can you tell me about your other requirements?",Yes
312,Can you show me 3BHK flats at DLF Camellias?,"Yes, what are your other requirements?",Yes
313,Show me fully furnished apartments at DLF Camellias,Sure. Let me look up the best options suitable for you.,Yes
314,Give me information on DLF Camellias,Looking up the desired information.,Yes
315,Show me good under construction projects to invest in.,"Alright, What are your other requirements?",Yes
316,Looking for hot properties in Gurgaon to invest in.,Excellent! Let me help you with that.,Yes
317,Show me projects by Alpha Corp,Sure. Let me look up the best options.,Yes
318,I want to invest in Alpha Corp projects,Great choice. Let me look up the best options for you,Yes
319,Give me information on Alpha Corp Group,"Sure, let me look up the information required",Yes
320,Can you show me under construction projects by Alpha Corp?,Most certainly. What are your other requirements?,Yes
321,Who is the developer of Heritage One?,Let me find that out for you.,Yes
322,Is it advisable to invest in property in GGN?,"Yes, Let me help you look for the best options available for you.",Yes
323,I want to look for apartments in and around Sector 48,Great. Let me help you with that. ,Yes
324,Are there any under construction projects in sector 34?,Let me generate a listing of the best options available,Yes
325,Show me fully furnished 3BHK apartments in Sector 50.,Okay. What are your other requirements?,Yes
326,Housing options in Sector 48,let me help you look for the best options available.,Yes
327,I want to look for apartments in New Gurgaon,Great choice! What else do you require?,Yes
328,Show me under construction Projects on Sohna Road,Sure. Let me show you the best options available,Yes
329,Looking for 2BHK on M.G. Road,Let me help you look for the top alternatives available.,Yes
330,Can you help me buy property on Dwarka Expressway?,Sure. What are your other requirements?,Yes
331,Housing options on Golf Course Extension Road,Let me generate a listing of the best options available,Yes
332,Is New Gurgaon a good location to invest in Real Estate?,"yes, Let me help you look through options to make the best decision.",Yes 
333,What are the most popular residential locations in Gurgaon?,Let me look that up for you,Yes
334,Top Rated residential locations in Gurgaon,Searching for the best options for you to choose from,Yes
335,Show me top rated residential locations on M.G. Road,Showing you the best options for you to make a pick,Yes
336,Top Rated commercial spaces in Gurgaon,"Sorry, we do not provide the facility yet. Watch this space in future to avail that facility.",No
337,What are the total acres of land covered by Clarion the Legend?,Hold on as I look for the required information.,Yes
338,Give me details of the total land area coverage by Clarion the Legend,"Okay, let me find that out for you.",Yes
339,Clarion the Legend covers how much land area?,Let me look up the requested information.,Yes
340,Show me the biggest societies in terms of Land Area coverage in GGN.,"Sure, let me show you the best options available",Yes
341,How many units does DLF Bevery Park have?,Let me find that out.,Yes
342,Give me details of the number of floors in each tower at Garden Estate.,"Sure, let me quickly look that up.",Yes
343,No. of floors in Garden Estate towers,Let me quickly look that up,Yes
344,Are there more than 20 floors in Garden Estate towers?,Let me look up the requested information for you.,Yes
345,Show me the specification of buildings at Garden Estate,Looking for the desired information regarding your query.,Yes
346,Data on towers at Garden Estate,Let me look up the data you requested for.,Yes
347,Can you giveme Garden Estate's detailed profile?,Sure. Let me search for it.,Yes
348,How many towers does DLF Bevery Park II have?,Let me find that out for you.,Yes
349,Number of buidings at DLF Beverly Park II.,Searching for the information requested by you.,Yes
350,Show me lifts per tower at Gurgaon Gateway,Hold on as I look for the required information.,Yes
351,Can you give me the details of lifts per building at Gurgaon Gateway?,"Sure, let me look for the details required by you.",Yes
352,Are resident and service lifts separate at Gurgaon Gateway?,Let me quickly find that out.,Yes
353,How many resident lifts are provided in each building at Gurgaon Gateway?,Let me look up the requested information for you.,Yes
354,Are there service lifts apart from Residence lifts at Gurgaon Gateway?,Finding out the information requested by you.,Yes
355,Does Eldeco Mansions provide extra car parking?,"Hold on, let me quickly find that out.",Yes
356,Show me car parking details at Eldeco Mansions,Okay. Let me look up the requested details.,Yes
357,Can you help me with information on car parking at Eldeco Mansions?,"Sure, Let me search for the desired information.",Yes
358,Is there extra parking space provided at Eldeco Mansions?,Let me look up the data you requested for.,Yes
359,What is the parking area allotment like at Eldeco Mansions?,Let me find that out for you.,Yes
360,Is there ample parking space provided at Eldeco Mansions?,Hold on as I look for the required information.,Yes
361,Give me information on resident car parking charges at Eldeco Mansions,"Okay, Let me look up the desired details.",Yes
362,Guest car parking charges at Eldeco Mansions,Let me search for the details you require.,Yes
363,Does Eldeco Mansions provide guest car parking service?,Let me find out about your choice of service,Yes
364,Is there additional parking space for visitor cars at Eldeco Mansions?,Finding information on your selected service.,Yes
365,Is Visitor car parking service available at Eldeco Mansions?,Looking for the desired information regarding your query.,Yes
366,What construction company handled Aravali Homes?,Let me look that up.,Yes
367,Show me construction details of Aravali Homes,"Okay, watch the space below for the answer to your query.",Yes
368,Can you help me look at the progress made at the construction of Aravali Homes?,Surely. Let me find that out for you.,Yes
369,Aravali Homes construction update,Checking for the desired updates.,Yes
370,Aravali Homes construction company details,Looking up the desired information.,Yes
371,Show me the Construction Company profile that handled Aravali Homes,"Okay, hold on while I look for the requested information.",Yes
372,I want to see the Developer profile of Aravali Homes,"Alright, let me find that out for you.",Yes
373,Can you give me the maintenance office details for Chintels Paradiso,"Yes, watch the space below..",Yes
374,Info on maintenance office at Chintels Paradiso,Finding information on your selected service.,Yes
375,Show me Chintels Paradiso maintenance office contact details,Showing you the details of the service you require,Yes
376,Contact Chintels Paradiso maintenance Office for me,"Sorry, we do not provide that facility. Please use the contact information provided below.",No
377,How do I contact Chintels Paradiso Maintenance Office?,Let me help you with that.,Yes
378,What the are the working hours for Chintels Paradiso Maintenance office?,Checking for the desired information..,Yes
379,Can you tell me the timings for the Maintenance office at Chintels Paradiso?,"Yes, let me check for the desired information",Yes
380,Show me work timings at maintenance office at Chintels Paradiso.,Showing you the details of the data you require,Yes
381,Chintels Paradiso Maintenance Office working hours.,Let me look that up for you,Yes
382,Can you give me information on the RWA at DLF Silver Oaks?,"Yes, watch the space below..",Yes
383,I want contact details of DLF Silver Oaks RWA.,Finding information on your selected service.,Yes
384,Help me contact the RWA at DLF Silver Oaks,Sure. Let me find out the details you require.,Yes
385,Is there a website for the RWA of DLF Silver Oaks?,Let me quickly look that up,Yes
386,What architecture firm is handling the current DLF projects?,Checking for the required data..,Yes
387,Who was the architect for MGF the Vilas?,Let me quickly find that out for you,Yes
388,Can you help me find the landscape designer of MGF the Vilas?,"Yes, Hold on as I look for the desired information.",Yes
389,Looking for MGF the Vilas's Landscapist,Let me help you with that.,Yes
390,Find the architect and Landscape designer for MGF the Vilas,Wait just a moment as I furnish the requested information,Yes
391,Give me detail on the designers behind MGF the Vilas,Looking for the details requested by you.,Yes
392,Show me the configuration of a 4BHK in DLF pinnacle,"Okay, watch the space below..",Yes
393,Can you help me look at the configuration of apartments at DLF pinnacle?,"Yes, Keep an eye on the place below for it",Yes
394,What types of property does DLF pinnacle have for purchasing?,Let me quickly find that out for you,Yes
395,What kinds of apartments are available for rent at DLF pinnacle?,Checking for the requested data..,Yes
396,Show me the number of washrooms at a 3BHK at DLF pinnacle,"Okay, let me find that out for you.",Yes
397,Can I see the balconies at a 2BHK at DLF pinnacle?,"Sure, Let me check for the desired information.",Yes
398,Show me apartments on the Dwarka Expressway that are Vastu Compliant,"Okay, let me show you options most suitable to your requirements.",Yes
399,I want to look for apartments to buy which are built acording to Vastu Shastra,"Okay, let me help you with that.",Yes
400,Show only Vastu Compliant homes up for renting,"Alright, let me show you the most suitable options suitable for you.",Yes
401,Is this apartment constructed according to Vastu rules?,Let me find that out for you.,Yes
402,Can you help me look for Vastu Compliant homes in GGN?,"Certainly, what are your other requirements?",Yes
403,What are the number of parking spaces allotted per apartment at Raheja Vanya?,Let me search for the details you require.,Yes
404,Raheja Vanya car parking per apartment,Hold on as I look for the required information.,Yes
405,Show me the Parking area provided per apartment at Raheja Vanya,"Okay, let me find that out for you.",Yes
406,Is there ample parking space provided per apartment at Raheja Vanya?,Hold on as I look for the required information.,Yes
407,Is there any servant quarter provided inside the 4BHK at Ramprastha Rise?,Looking for the details requested by you.,Yes
408,Show me apartments with a servant quarter at Ramprastha Rise.,"Okay, let me find the options most suitable according to your requirement.",Yes
409,Can you help me look for apartments to buy that include a servant room or utility area?,"Yes, let me generate a listing of apartments most suitable to your needs.",Yes
410,Help me look for apartments at Ramprastha Rise that provide the facility of a separate utility room,"Surely, Let me look for the best options available for you.",Yes
411,Show me top societies which provide servant accomodation.,"Okay, Watch the space below for the best options suitable for you.",Yes
